{"id":"case-uap-data-leak-analysis","slug":"uap-data-leak-analysis","title":"UAP data leak analysis","dek":"A demonstration case shell retained from the former homepage while source-level research is commissioned.","topic":"UAP","status":"demonstration","review":{"human_reviewed":false,"reviewer":""},"published_at":null,"updated_at":"2026-07-23","summary":"This title previously appeared as a homepage feature without a supporting case record. It is now explicitly quarantined as a demonstration and must not be read as a completed investigation.","ai_disclosure":"No substantive AI research is published in this demonstration record. Future AI assistance must be disclosed and human reviewed.","hero":{},"related_event_ids":[],"featured":false}
