{
  "id": "case-uap-disclosure-convergence",
  "slug": "uap-disclosure-convergence",
  "title": "UAP disclosure: records, advocacy, and testimony",
  "dek": "What public reporting establishes about the disclosure process—and where extraordinary claims still outrun the record.",
  "topic": "UAP",
  "status": "published",
  "review": {"human_reviewed": true, "reviewer": "The Unverified File editorial review"},
  "published_at": "2026-05-22",
  "updated_at": "2026-07-23",
  "summary": "Government records, institutional reporting, and congressional activity establish an active UAP disclosure debate. They do not independently establish claims of non-human technology, which remain unverified in the sources reviewed here.",
  "ai_disclosure": "Local AI assisted with source grouping, summarization, and connection suggestions. A human reviewed the public record, wording, citations, and publication state. AI output is not treated as evidence.",
  "hero": {"src": "https://science.nasa.gov/wp-content/uploads/2022/06/uap-meeting-2023-e1692299097471.jpeg?resize=1200,513", "alt": "Members of NASA's UAP independent study team at a public meeting", "credit": "NASA", "source_url": "https://science.nasa.gov/uap/"},
  "related_event_ids": [],
  "featured": true
}
