{
  "id": "case-microtubules-anesthesia-and-quantum-consciousness-claims",
  "slug": "microtubules-anesthesia-and-quantum-consciousness-claims",
  "title": "Microtubules, anesthesia, and quantum-consciousness claims",
  "dek": "A source-led examination of what an anesthetized-rat experiment found—and what it cannot establish about quantum consciousness.",
  "topic": "Consciousness research",
  "status": "draft",
  "review": {
    "human_reviewed": false,
    "reviewer": ""
  },
  "published_at": null,
  "updated_at": "2026-07-27",
  "summary": "A 2024 rat experiment found that epothilone B delayed loss of righting reflex under isoflurane. That result supports further study of microtubules in anesthetic response, but it does not establish a quantum mechanism, an account of human consciousness, or a connection between consciousness and the universe.",
  "ai_disclosure": "AI assisted with source discovery and draft organization. The Lab presents the original study, related reporting, and methodological limits as separate records; AI output is not evidence and this draft is not a published finding.",
  "hero": {},
  "related_event_ids": [],
  "featured": false
}
