{"id":"case-ancient-tech-artifacts","slug":"ancient-tech-artifacts","title":"Ancient technology artifact claims","dek":"A demonstration case shell for comparing archaeological context with extraordinary interpretations.","topic":"Archaeology","status":"demonstration","review":{"human_reviewed":false,"reviewer":""},"published_at":null,"updated_at":"2026-07-23","summary":"This broad concept previously appeared as a homepage feature without a defined artifact or source set. It remains a demonstration until it is divided into specific, researchable claims.","ai_disclosure":"No substantive AI research is published in this demonstration record. Future AI assistance must be disclosed and human reviewed.","hero":{},"related_event_ids":[],"featured":false}
