{"id":"case-fema-weather-weaponry-claims","slug":"fema-weather-weaponry-claims","title":"FEMA and weather-weaponry claims","dek":"A demonstration case shell for evaluating a recurring online claim without amplifying it as established fact.","topic":"Misinformation","status":"demonstration","review":{"human_reviewed":false,"reviewer":""},"published_at":null,"updated_at":"2026-07-23","summary":"This concept previously appeared as a homepage feature without citations. It is retained only as a visible demonstration record pending a scoped claim, primary sources, and editorial review.","ai_disclosure":"No substantive AI research is published in this demonstration record. Future AI assistance must be disclosed and human reviewed.","hero":{},"related_event_ids":[],"featured":false}
